{
  "auto_mutation_allowed": false,
  "auto_rule_promotion_allowed": false,
  "auto_training_allowed": false,
  "claim_verdict": "NO_CLAIM_ALLOWED",
  "corrective_action_taken": "PatchPack was merged after HumanGate review and required checks.",
  "created_by": "CODEX_REPORT_INTAKE",
  "event_outcome": "SUCCESS",
  "evidence_refs": [
    "gh:merged_pr",
    "local:validation summary"
  ],
  "evidence_verdict": "WORKFLOW_COMPLETION_RECORD_ONLY",
  "failure_taxonomy": "NONE",
  "human_gate_required": true,
  "impact": "Control-plane documentation and local tooling advanced without runtime or ML changes.",
  "learning_event_id": "LE-225-4c9f8b64merge",
  "observed_symptom": "Merged PatchPack completed its local validation and remote checks.",
  "preventive_rule_candidate": {
    "applies_to": "future control-plane PatchPacks",
    "auto_apply_allowed": false,
    "proposal": "Successful PatchPack reports should preserve exact validation commands and HumanGate boundaries.",
    "requires_human_approval": true,
    "rule_id": "LE-RULE-success-report-validation"
  },
  "root_cause": "PatchPack stayed within control-plane scope and passed required review gates",
  "schema_version": "studiopilot.learning_event.v0",
  "software_verdict": "CONTROL_PLANE_PATCHPACK_MERGED",
  "source_event_type": "PR_MERGED",
  "source_head_sha": "4c9f8b64e3f3e70a8bd1e3949ad29217abcd1234",
  "source_merge_sha": "4c9f8b64merge0000000000000000000000000000",
  "source_pr_number": 225,
  "status": "DRAFT",
  "trigger_summary": "A bounded control-plane PatchPack merged after validation."
}
